"Id";"Lat";"Lng";"Infowindow originale";"Storia originale";"Oggi originale";"Situazione attuale";"Ubicazione";"Percorso di assegnazione";"Data e motivo del sequestro e della confisca";"Descrizione del bene";"Sottotipologia";"Tipologia";"Profilo intestatario";"Email";"Sito web";"CAP";"Indirizzo";"URL Dettagli";"URL Immagine"
121;45,053257;7,6263752;"<div class='locationinfo post-location-info'>      <img width='100' height='300' src='http://geobeni.liberapiemonte.it/wp-content/uploads/2014/03/barItalia-100x300.jpg' class='attachment-infowindow' alt='barItalia' />    <h2><a href='http://geobeni.liberapiemonte.it/beni_confiscati/bar-italia-libera-2/' title='via Veglia 59/a'>via Veglia 59/a</a></h2>    <p>Via Veglia, 10136 Turin, Italy</p>          <p><a href='http://bar.nanacoop.it/'>Sito Internet</a></p>          <p><a href='mailto:info@nanacoop.it'>Indirizzo Email</a></p>    </div>";"<body class='single single-bene_confiscato postid-121'><div class='page-wrapper'><section class='site-content'>    <div class='info'><div class='titolo_post'><h2>  via Veglia 59/a</h2></div></div>  <div class='tabs'><div class='tab tab_storia'>  <a href='http://geobeni.liberapiemonte.it/beni_confiscati/bar-italia-libera-2/?tab=history' class='selected'>Storia</a></div><div class='tab tab_oggi'>  <a href='http://geobeni.liberapiemonte.it/beni_confiscati/bar-italia-libera-2/?tab=today'>Oggi</a></div><div class='tab tab_foto'>  <a href='http://geobeni.liberapiemonte.it/beni_confiscati/bar-italia-libera-2/?tab=photo'>Foto</a></div><div class='tab tab_video'>  <a href='http://geobeni.liberapiemonte.it/beni_confiscati/bar-italia-libera-2/?tab=video'>Video</a></div></div><div class='content'>          <ul>  <li><div class='titolo_storia'>  Profilo intestatario</div><div class='descrizione'><p>  <p>Il bene è intestato a Catalano Rosetta. Questo 'era un luogo cruciale per l'organizzazione criminale', 'qui avvenivano riti come l'affiliazione e il taglio della coda, si decidevano ruoli nell'organizzazione e si pilotavano gli appalti'. Tutto sotto gli occhi di Giuseppe Catalano, marito della titolare, arrestato, insieme ad altri 153 presunti 'ndranghetisti il 6 giugno del 2011 e suicidatosi l'anno seguente. In particolare dagli atti dell'inchiesta Minotauro, si legge sia l'appartenenza di Catalano all'associane di stampo mafioso 'ndrangheta, sia il particolare ruolo di assoluto rilievo dal lui ricoperto: tale carica lo ha portato ad essere protagonista di varie vicende inerenti l'intero sodalizio 'ndranghetista nella sua dimensione territoriale piemontese.</p></p></div></li><li><div class='titolo_storia'>  Tipologia</div><div class='descrizione'><p>  <p>Un locale</p></p></div></li><li><div class='titolo_storia'>  Sottotipologia</div><div class='descrizione'><p>  <p>Il locale è un esercizio commerciale</p></p></div></li><li><div class='titolo_storia'>  Descrizione del bene</div><div class='descrizione'><p>  <p>Il locale è un esercizio commerciale, in particolare un bar</p></p></div></li><li><div class='titolo_storia'>  Data e motivo del sequestro e della confisca</div><div class='descrizione'><p>  <p>Il tribunale di Torino emette la confisca definitiva del bene in data 27.02.2014.</p></p></div></li><li><div class='titolo_storia'>  Percorso di assegnazione</div><div class='descrizione'><p>  <p>Il bar è stato dato in concessione a Libera Piemonte, tramite la Cooperativa Nanà, ancora in fase di sequestro a partire dal 1 febbraio 2013, in quanto la confisca definitiva è arrivata circa un anno dopo tale concessione.</p></p></div></li></ul></div></section></div>  <script type='text/javascript' src='http://geobeni.liberapiemonte.it/wp-content/themes/geoblog/assets/javascripts/jquery.colorbox.js?ver=3.9.2'></script><script type='text/javascript' src='http://geobeni.liberapiemonte.it/wp-content/themes/geoblog/assets/javascripts/application.js?ver=3.9.2'></script></body></html>";"<body class='single single-bene_confiscato postid-121'><div class='page-wrapper'><section class='site-content'>    <div class='info'><div class='titolo_post'><h2>  via Veglia 59/a</h2></div></div>  <div class='tabs'><div class='tab tab_storia'>  <a href='http://geobeni.liberapiemonte.it/beni_confiscati/bar-italia-libera-2/?tab=history'>Storia</a></div><div class='tab tab_oggi'>  <a href='http://geobeni.liberapiemonte.it/beni_confiscati/bar-italia-libera-2/?tab=today' class='selected'>Oggi</a></div><div class='tab tab_foto'>  <a href='http://geobeni.liberapiemonte.it/beni_confiscati/bar-italia-libera-2/?tab=photo'>Foto</a></div><div class='tab tab_video'>  <a href='http://geobeni.liberapiemonte.it/beni_confiscati/bar-italia-libera-2/?tab=video'>Video</a></div></div><div class='content'>      <ul>  <li><div class='titolo_progetto'>  Bar</div><div class='descrizione'><p>  <p style='text-align: justify;'>Dopo quasi due anni dalla chiusura del bar Italia, grazie a Libera Piemonte e alla Cooperativa Nanà, che ne ha in carico la gestione, il bar ha riaperto il 3 maggio 2013. All'inaugurazione hanno partecipato il procuratore Giancarlo Caselli, don Luigi Ciotti e molti ufficiali dei carabinieri e delle forze armate che hanno contribuito all'indagine dalla quale è scaturito il sequestro del bar.</p><p style='text-align: justify;'>Ora il bar, come ha detto Don Luigi Ciotti, 'E' un luogo non solo di ristoro, ma anche di risveglio per la città, per ricordare che la mafia a volte ti offre anche il caffè'.</p></p></div></li></ul></div></section></div>  <script type='text/javascript' src='http://geobeni.liberapiemonte.it/wp-content/themes/geoblog/assets/javascripts/jquery.colorbox.js?ver=3.9.2'></script><script type='text/javascript' src='http://geobeni.liberapiemonte.it/wp-content/themes/geoblog/assets/javascripts/application.js?ver=3.9.2'></script></body></html>";"Dopo quasi due anni dalla chiusura del bar Italia, grazie a Libera Piemonte e alla Cooperativa Nanà, che ne ha in carico la gestione, il bar ha riaperto il 3 maggio 2013. All'inaugurazione hanno partecipato il procuratore Giancarlo Caselli, don Luigi Ciotti e molti ufficiali dei carabinieri e delle forze armate che hanno contribuito all'indagine dalla quale è scaturito il sequestro del bar. Ora il bar, come ha detto Don Luigi Ciotti, 'E' un luogo non solo di ristoro, ma anche di risveglio per la città, per ricordare che la mafia a volte ti offre anche il caffè'. ";;"Il bar è stato dato in concessione a Libera Piemonte, tramite la Cooperativa Nanà, ancora in fase di sequestro a partire dal 1 febbraio 2013, in quanto la confisca definitiva è arrivata circa un anno dopo tale concessione. ";"Il tribunale di Torino emette la confisca definitiva del bene in data 27. 02. 2014. ";"Il locale è un esercizio commerciale, in particolare un bar";"Il locale è un esercizio commerciale";"Un locale";"Il bene è intestato a Catalano Rosetta. Questo 'era un luogo cruciale per l'organizzazione criminale', 'qui avvenivano riti come l'affiliazione e il taglio della coda, si decidevano ruoli nell'organizzazione e si pilotavano gli appalti'. Tutto sotto gli occhi di Giuseppe Catalano, marito della titolare, arrestato, insieme ad altri 153 presunti 'ndranghetisti il 6 giugno del 2011 e suicidatosi l'anno seguente. In particolare dagli atti dell'inchiesta Minotauro, si legge sia l'appartenenza di Catalano all'associane di stampo mafioso 'ndrangheta, sia il particolare ruolo di assoluto rilievo dal lui ricoperto: tale carica lo ha portato ad essere protagonista di varie vicende inerenti l'intero sodalizio 'ndranghetista nella sua dimensione territoriale piemontese. ";"info@nanacoop.it";"http://bar.nanacoop.it/";"Via Veglia, 10136 Turin, Italy";"via Veglia 59/a";"http://geobeni.liberapiemonte.it/beni_confiscati/bar-italia-libera-2/";"http://geobeni.liberapiemonte.it/wp-content/uploads/2014/03/barItalia-100x300.jpg"
140;45,9281845;8,5554714;"<div class='locationinfo post-location-info'>          <h2><a href='http://geobeni.liberapiemonte.it/beni_confiscati/localita-briganzolo/' title='Località Briganzolo'>Località Briganzolo</a></h2>    <p>28922 Verbania Verbano-Cusio-Ossola, Italy</p>    </div>";"<body class='single single-bene_confiscato postid-140'><div class='page-wrapper'><section class='site-content'>    <div class='info'><div class='titolo_post'><h2>  Località Briganzolo</h2></div></div>  <div class='tabs'><div class='tab tab_storia'>  <a href='http://geobeni.liberapiemonte.it/beni_confiscati/localita-briganzolo/?tab=history' class='selected'>Storia</a></div><div class='tab tab_oggi'>  <a href='http://geobeni.liberapiemonte.it/beni_confiscati/localita-briganzolo/?tab=today'>Oggi</a></div><div class='tab tab_foto'>  <a href='http://geobeni.liberapiemonte.it/beni_confiscati/localita-briganzolo/?tab=photo'>Foto</a></div><div class='tab tab_video'>  <a href='http://geobeni.liberapiemonte.it/beni_confiscati/localita-briganzolo/?tab=video'>Video</a></div></div><div class='content'>        <table border='1' cellspacing='0' cellpadding='0'><tbody><tr><td valign='top' width='652'><strong>PROFILO INTESTATARIO</strong></td></tr><tr><td valign='top' width='652'>I beni sono intestati a Iervolino Iolanda e Galasso Ciro.</td></tr><tr><td valign='top' width='652'><strong> </strong></td></tr><tr><td valign='top' width='652'><strong>TIPOLOGIA</strong></td></tr><tr><td valign='top' width='652'>Un'abitazione, un locale, un terreno e un altro bene immobile</td></tr><tr><td valign='top' width='652'><strong>SOTTOTIPOLOGIA</strong></td></tr><tr><td style='text-align: justify;' valign='top' width='652'>L'abitazione è una villa, il locale è un box/garage, il terreno è di tipo agricolo e l'altro bene immobile è un cortile.</td></tr><tr><td valign='top' width='652'><strong>DESCRIZIONE DEL BENE</strong></td></tr><tr><td style='text-align: justify;' valign='top' width='652'>Il box auto, il terreno e il cortile sono tutti di pertinenza alla Villa, la quale è costituita da un seminterrato con sette ripostigli, una sauna con ripostiglio adibito a piscina coperta e un'autorimessa, un piano terra di superficie 150 mq, un primo piano di superficie 124 mq e un secondo piano di 102 mq.</td></tr><tr><td valign='top' width='652'><strong>UBICAZIONE</strong></td></tr><tr><td valign='top' width='652'>Località Briganzolo, Verbania</td></tr><tr><td valign='top' width='652'><strong>DATA E MOTIVO DEL SEQUESTRO E DELLA CONFISCA</strong></td></tr><tr><td valign='top' width='652'>Il tribunale di Verbania emette la confisca definitiva sui beni in data 14.07.2000.</td></tr><tr><td valign='top' width='652'><strong>PERCORSO DI ASSEGNAZIONE</strong></td></tr><tr><td valign='top' width='652'>I beni sono stati destinati in data 13.07.2006 alla polizia di Stato con la finalità di alloggi di servizio.</p><p style='text-align: justify;'>Successivamente è stata proposta un'istanza di revisione della sentenza di condanna penale presso la corte d'appello di Milano, questa è stata rigettata con provvedimento a sua volta impugnato in cassazione. Con un'istanza del 7.10.2009, Galasso chiedeva alla scrivente la sospensione della confisca dell'immobile.</p><p style='text-align: justify;'>Con nota del 07.02.2012 viene fatta una comunicazione all'Agenzia Nazionale Beni Sequestrati e Confiscati che polizia non vuole l'immobile in gestione e che quest'ultimo non è idoneo per  usi governativi.</p></td></tr></tbody></table>  <ul>  </ul></div></section></div>  <script type='text/javascript' src='http://geobeni.liberapiemonte.it/wp-content/themes/geoblog/assets/javascripts/jquery.colorbox.js?ver=3.9.2'></script><script type='text/javascript' src='http://geobeni.liberapiemonte.it/wp-content/themes/geoblog/assets/javascripts/application.js?ver=3.9.2'></script></body></html>";"<body class='single single-bene_confiscato postid-140'><div class='page-wrapper'><section class='site-content'>    <div class='info'><div class='titolo_post'><h2>  Località Briganzolo</h2></div></div>  <div class='tabs'><div class='tab tab_storia'>  <a href='http://geobeni.liberapiemonte.it/beni_confiscati/localita-briganzolo/?tab=history'>Storia</a></div><div class='tab tab_oggi'>  <a href='http://geobeni.liberapiemonte.it/beni_confiscati/localita-briganzolo/?tab=today' class='selected'>Oggi</a></div><div class='tab tab_foto'>  <a href='http://geobeni.liberapiemonte.it/beni_confiscati/localita-briganzolo/?tab=photo'>Foto</a></div><div class='tab tab_video'>  <a href='http://geobeni.liberapiemonte.it/beni_confiscati/localita-briganzolo/?tab=video'>Video</a></div></div><div class='content'>      <ul>  </ul></div></section></div>  <script type='text/javascript' src='http://geobeni.liberapiemonte.it/wp-content/themes/geoblog/assets/javascripts/jquery.colorbox.js?ver=3.9.2'></script><script type='text/javascript' src='http://geobeni.liberapiemonte.it/wp-content/themes/geoblog/assets/javascripts/application.js?ver=3.9.2'></script></body></html>";;"Località Briganzolo, Verbania";"I beni sono stati destinati in data 13. 07. 2006 alla polizia di Stato con la finalità di alloggi di servizio. Successivamente è stata proposta un'istanza di revisione della sentenza di condanna penale presso la corte d'appello di Milano, questa è stata rigettata con provvedimento a sua volta impugnato in cassazione. Con un'istanza del 7. 10. 2009, Galasso chiedeva alla scrivente la sospensione della confisca dell'immobile. Con nota del 07. 02. 2012 viene fatta una comunicazione all'Agenzia Nazionale Beni Sequestrati e Confiscati che polizia non vuole l'immobile in gestione e che quest'ultimo non è idoneo per usi governativi. ";"Il tribunale di Verbania emette la confisca definitiva sui beni in data 14. 07. 2000. ";"Il box auto, il terreno e il cortile sono tutti di pertinenza alla Villa, la quale è costituita da un seminterrato con sette ripostigli, una sauna con ripostiglio adibito a piscina coperta e un'autorimessa, un piano terra di superficie 150 mq, un primo piano di superficie 124 mq e un secondo piano di 102 mq. ";"L'abitazione è una villa, il locale è un box/garage, il terreno è di tipo agricolo e l'altro bene immobile è un cortile. ";"Un'abitazione, un locale, un terreno e un altro bene immobile";"I beni sono intestati a Iervolino Iolanda e Galasso Ciro. ";;;"28922 Verbania Verbano-Cusio-Ossola, Italy";"Località Briganzolo";"http://geobeni.liberapiemonte.it/beni_confiscati/localita-briganzolo/";
139;45,1834412;7,7158222;"<div class='locationinfo post-location-info'>          <h2><a href='http://geobeni.liberapiemonte.it/beni_confiscati/leini/' title='Leinì'>Leinì</a></h2>    <p>10040 Leinì Turin, Italy</p>    </div>";"<body class='single single-bene_confiscato postid-139'><div class='page-wrapper'><section class='site-content'>    <div class='info'><div class='titolo_post'><h2>  Leinì</h2></div></div>  <div class='tabs'><div class='tab tab_storia'>  <a href='http://geobeni.liberapiemonte.it/beni_confiscati/leini/?tab=history' class='selected'>Storia</a></div><div class='tab tab_oggi'>  <a href='http://geobeni.liberapiemonte.it/beni_confiscati/leini/?tab=today'>Oggi</a></div><div class='tab tab_foto'>  <a href='http://geobeni.liberapiemonte.it/beni_confiscati/leini/?tab=photo'>Foto</a></div><div class='tab tab_video'>  <a href='http://geobeni.liberapiemonte.it/beni_confiscati/leini/?tab=video'>Video</a></div></div><div class='content'>        <table border='1' cellspacing='0' cellpadding='0'><tbody><tr><td valign='top' width='652'><strong>PROFILO INTESTATARIO</strong></td></tr><tr><td valign='top' width='652'>I beni sono intestati a Assisi Nicola e Falletta Rosaria</td></tr><tr><td valign='top' width='652'><strong>TIPOLOGIA</strong></td></tr><tr><td valign='top' width='652'>Un locale e quattro terreni</td></tr><tr><td valign='top' width='652'><strong>SOTTOTIPOLOGIA</strong></td></tr><tr><td valign='top' width='652'>Il locale è generico, mentre i terreni sono di tipo agricolo</td></tr><tr><td valign='top' width='652'><strong>DESCRIZIONE DEL BENE</strong></td></tr><tr><td valign='top' width='652'>Il locale è un deposito</td></tr><tr><td valign='top' width='652'><strong>UBICAZIONE</strong></td></tr><tr><td valign='top' width='652'>Leinì (TO)</td></tr><tr><td valign='top' width='652'><strong>DATA E MOTIVO DEL SEQUESTRO E DELLA CONFISCA</strong></td></tr><tr><td style='text-align: justify;' valign='top' width='652'>Il tribunale di Torino emette la confisca definitiva sui beni in data 17.12.2009.</td></tr></tbody></table>  <ul>  </ul></div></section></div>  <script type='text/javascript' src='http://geobeni.liberapiemonte.it/wp-content/themes/geoblog/assets/javascripts/jquery.colorbox.js?ver=3.9.2'></script><script type='text/javascript' src='http://geobeni.liberapiemonte.it/wp-content/themes/geoblog/assets/javascripts/application.js?ver=3.9.2'></script></body></html>";"<body class='single single-bene_confiscato postid-139'><div class='page-wrapper'><section class='site-content'>    <div class='info'><div class='titolo_post'><h2>  Leinì</h2></div></div>  <div class='tabs'><div class='tab tab_storia'>  <a href='http://geobeni.liberapiemonte.it/beni_confiscati/leini/?tab=history'>Storia</a></div><div class='tab tab_oggi'>  <a href='http://geobeni.liberapiemonte.it/beni_confiscati/leini/?tab=today' class='selected'>Oggi</a></div><div class='tab tab_foto'>  <a href='http://geobeni.liberapiemonte.it/beni_confiscati/leini/?tab=photo'>Foto</a></div><div class='tab tab_video'>  <a href='http://geobeni.liberapiemonte.it/beni_confiscati/leini/?tab=video'>Video</a></div></div><div class='content'>      <ul>  </ul></div></section></div>  <script type='text/javascript' src='http://geobeni.liberapiemonte.it/wp-content/themes/geoblog/assets/javascripts/jquery.colorbox.js?ver=3.9.2'></script><script type='text/javascript' src='http://geobeni.liberapiemonte.it/wp-content/themes/geoblog/assets/javascripts/application.js?ver=3.9.2'></script></body></html>";;"Leinì (TO)";;"Il tribunale di Torino emette la confisca definitiva sui beni in data 17. 12. 2009. ";"Il locale è un deposito";"Il locale è generico, mentre i terreni sono di tipo agricolo";"Un locale e quattro terreni";"I beni sono intestati a Assisi Nicola e Falletta Rosaria";;;"10040 Leinì Turin, Italy";"Leinì";"http://geobeni.liberapiemonte.it/beni_confiscati/leini/";
